{
  "schema_version": "stage1-review-v1",
  "status": "DRAFT_FOR_HUMAN_VALIDATION",
  "as_of": "2026-10-01",
  "scope": "Stage 1 only; user-confirmed meanings are recorded separately from unresolved technical mappings; no implementation authorization",
  "rules": [
    {
      "rule_id": "MAP-01",
      "domain": "database_identity",
      "business_meaning": "Identita každého záznamu musí obsahovat databázový namespace; stejné číslo ve dvou DB neznamená stejný objekt.",
      "db_representation": "MAIN=C:/Medicus 3/data/MEDICUS.FDB; LASER=C:/Medicus 3 Laser/data/MEDICUS.FDB; IDUZI/IDPAC/IDOBJ/IDCINNOSTI jsou lokální.",
      "implementation_location": "scripts/db.py::connect_to_db; scripts/laser_calendar.py::open_scan_calendar",
      "evidence": "LIVE.databases; DOC-LASER",
      "confidence": "CONFIRMED",
      "impact_if_wrong": "Záměna pacienta, lékaře nebo aktivity při zápisu.",
      "reproducible_test_case": "Porovnat MAIN.IDUZI=1 (Tereza Pérez) s LASER.IDUZI=1 (Eva Bednářová); nesloučit.",
      "unresolved_question": "Jaký stabilní identifikátor fyzického zdroje/personálu je společný napříč instancemi?"
    },
    {
      "rule_id": "MAP-02",
      "domain": "service_skin",
      "business_meaning": "Uživatel potvrdil: běžné kožní vyšetření je samostatná lékařská prohlídka hrazená pojišťovnou. Nezahrnuje automatický sken ani navazující rezervaci dermatoskopu. Placená dermatoskopie je oddělená služba.",
      "db_representation": "MAIN.OBJOBJ.IDCINNOSTI=NULL; followup.create=false; dřívější dokument požaduje další řádek IDCINNOSTI=6.",
      "implementation_location": "config/business_rules.example.json#/services/skin; scripts/agent_context.py::build_skin_options",
      "evidence": "LIVE.effective_rules; DOC-ACT; CONTRACT; USER-REVIEW-01",
      "confidence": "CONFIRMED",
      "impact_if_wrong": "Neoprávněně nabídnutý termín nebo zbytečná blokace/skener.",
      "reproducible_test_case": "Samotný požadavek skin nesmí vyžadovat ani vytvářet scan/followup rezervaci. Poslední slot smí projít bez navazujícího scanu, pokud vyhoví ostatním pravidlům délky a dostupnosti. Business očekávání potvrzeno uživatelem; nejde o povolení produkčního zápisu.",
      "unresolved_question": "Rozlišení služeb a absence automatického scanu vyřešeny uživatelem. Přesné mapování IDCINNOSTI=NULL, délka návštěvy a další pravidla se ověřují samostatně; nebyly touto odpovědí schváleny."
    },
    {
      "rule_id": "MAP-03",
      "domain": "service_dermatoscope_first",
      "business_meaning": "Uživatel potvrdil standard placené dermatoskopie: sken personálem a hned navazující osobní lékařská prohlídka při stejné návštěvě. Výjimečně lze objednat pouze sken, například pokud pacient nemá čas na prohlídku. Uživatel potvrdil, že agent má umožnit samostatný sken na výslovnou žádost pacienta, ale nemá jej běžně navrhovat. Jde o schválený požadavek na budoucí chování, nikoli o povolení přímých zápisů nebo nasazení. Kód předpokládá sken15min před lékařem; konkrétní délky ani DB mapování tím nejsou schváleny. Veřejná nabídka je zakázaná. Podle uživatele po samostatném skenu musí následovat osobní návštěva lékaře jindy; běžně nejpozději do3 měsíců od skenu, v krajních případech do6 měsíců. Již po3 měsících může sken ztrácet relevanci. Informování pacienta a případné domluvení termínu personálem po skenu uživatel navrhl; konkrétní odpovědnost a postup zatím nejsou uzavřeny. Uživatel schválil: agent termín prohlídky více než3 měsíce po skenu automaticky nenabízí, ale předá požadavek personálu k posouzení výjimky. Objednání přímo na místě po skenu je očekávané, nikoli zaručené. USER-REVIEW-06: uživatel předpokládá standardní sken15 minut, ale výslovně si není jistý. Delší trvání může být krajní výjimkou, kterou agent pravděpodobně neumí posoudit. Délka proto zůstává předběžná, nikoli nově CONFIRMED. USER-REVIEW-40 (předběžné): Uživatel navrhuje orientaci podle minulých návštěv, ale není si jistý rolí opakované dermatoskopie. Domnívá se, že jde o stejnou službu na vyžádání, případně opakovanou preventivní prohlídku po čase, nikoli samostatně rozlišovanou službu. Není tím potvrzeno sloučení service keys/aktivit, totožnost opakovaného skenu a kontroly bez skenu ani časový interval opakování. Záznam minulého objednání sám nedokazuje absolvovaný sken. USER-REVIEW-41: Uživatel upřesňuje pracovní členění na prohlídku, prohlídku s dermatoskopem a navazující kontrolu po vyšetření/zákroku; opakovaná či preventivní dermatoskopie podle něj není samostatná procedura. Na výslovný požadavek pacienta může agent navazující kontrolu objednat v budoucím návrhu. Uživatel navrhuje ověřit související datum v minulých návštěvách a odvodit doporučený termín; obvyklý rok od zákroku uvádí nejistě, nikoli jako potvrzenou univerzální či nejzazší lhůtu. Rozlišení skutečně absolvovaného relevantního výkonu od pouhé rezervace a zdroj doporučeného intervalu zůstávají k vyřešení. Neměnit tím samostatné pravidlo odložené prohlídky po skenu (3/6 měsíců).",
      "db_representation": "MAIN aktivita 1; LASER calendar 5/workplace 1 čtení; cílová aktivita zápisu LASER není specifikována.",
      "implementation_location": "config/business_rules.example.json#/services/dermatoscope_first; scripts/agent_context.py::build_dermatoscope_options; scripts/laser_calendar.py::ScanCalendar",
      "evidence": "LIVE.effective_rules; LIVE.laser_mapping; DOC-LASER; USER-OCT7; USER-REVIEW-01; USER-REVIEW-02; USER-REVIEW-03; USER-REVIEW-04; USER-REVIEW-05; USER-REVIEW-06; USER-REVIEW-40; USER-REVIEW-41; docs/current_business_rules.md",
      "confidence": "PROBABLE",
      "impact_if_wrong": "Chybějící kapacita skeneru nebo chybný typ výkonu.",
      "reproducible_test_case": "Standardní požadavek dermatoskopie potřebuje volný scan a hned navazující lékařskou prohlídku. Obsazený scan14:45–15:00 znemožní tuto kombinaci s lékařem15:00. Bez výslovného požadavku agent samostatný sken běžně nenavrhuje. Na výslovnou žádost umožní tuto variantu a nesmí ji zaměnit za kombinaci s prohlídkou. Konkrétní zápisová sémantika varianty zatím není schválená. Pro samostatný sken zdokumentovat potřebu další osobní návštěvy; rozlišit běžnou lhůtu do3 měsíců a krajní výjimku do6 měsíců. Nepovažovat automaticky šest měsíců za standardní platnost. Přesné hraniční případy čekají na potvrzení. Požadavek na prohlídku4 měsíce po skenu: agent nenabízí automatický termín, předá personálu; netvrdí, že návštěva je domluvena.",
      "unresolved_question": "Agent předává prohlídku po více než3 měsících personálu; zbývá určit oprávněnou roli k povolení výjimky, přesné hraniční datum a postup po6 měsících. Kdo zajistí skutečné domluvení pozdější návštěvy? Přesné délky, DB aktivity a vazby nadále otevřené. USER-REVIEW-40: Konkrétní otázka pro personál: při další preventivní návštěvě se znovu provádí sken i navazující prohlídka, nebo může jít pouze o kontrolu lékařem bez nového skenu; liší se způsob objednání? Následně přiřadit skutečné DB aktivity/service keys. Minulá objednání jsou uživatelem navržený zdroj kontextu, ne potvrzené automatické klasifikační pravidlo. USER-REVIEW-41: Ověřit mapování konkrétní navazující kontroly; lokální dokumentace rozlišuje dermatoscope_followup -> MAIN aktivita2 kontrola po skenu a regular_check -> aktivita5 Sken znamének2 a vyšší, ačkoli label je Kontrola po scanu. Tyto kategorie neprokazují univerzální kontrolu po libovolném zákroku. Roční interval není potvrzen; upřesnit zdroj a význam doporučené lhůty před automatickým doporučováním nejzazšího termínu."
    },
    {
      "rule_id": "MAP-04",
      "domain": "service_followup",